{
  "$schema": "./instrument.schema.json",
  "schema_version": "1.0.0",
  "study_id": "INTERP-DIALOGUE-001P0",
  "instrument_id": "INTERP-DIALOGUE-001P0-ELICITATION-INSTRUMENT-V0",
  "instrument_version": "0.0.0",
  "status": "FROZEN_UNEXECUTED_DEVELOPMENT_ELICITATION_ONLY",
  "authority": {
    "artifact_role": "DEVELOPMENT_ELICITATION_INSTRUMENT_CONTRACT",
    "execution_status": "UNEXECUTED",
    "measurement_status": "NO_FROZEN_RESPONSE_TO_INTERNAL_TRACE_MAPPING",
    "empirical_status": "NO_RESPONSE_DATA",
    "output_status": "NO_OBSERVATION_PLACEMENT_OR_CLAIM_RESULT"
  },
  "bound_source_artifacts": [
    {
      "source_id": "REL-BOUNDARY-001",
      "role": "SCENARIO_FAMILY",
      "path": "../families/rel-boundary.json",
      "content_sha256": "4eb342e655ded940ab8537f4e7827692829967a35f17feb375e731a24d2750e2"
    },
    {
      "source_id": "WORK-FEEDBACK-001",
      "role": "SCENARIO_FAMILY",
      "path": "../families/work-feedback.json",
      "content_sha256": "71cedb46667d1fc2ab76ee1e9711e8f0344e3fea6cf9bd16b577643d292d5823"
    },
    {
      "source_id": "RISK-FOOTSTEPS-001",
      "role": "SCENARIO_FAMILY",
      "path": "../families/risk-footsteps.json",
      "content_sha256": "4fbe69cbe8bd8edb631c9012810dbf935b69f10d5afa7c670638177eabb2a256"
    },
    {
      "source_id": "INTERP-DIALOGUE-001B-TRACE-ORACLE-V1",
      "role": "TRACE_ORACLE",
      "path": "../trace-oracle-v1.json",
      "content_sha256": "9caefdf39b9ac41c355f8afed0f4c5d0f780499f571346ef2a7042fa30da74b9"
    }
  ],
  "language_policy": {
    "participant_locale": "en",
    "source_descriptor_policy": "VERBATIM_BOUND_SOURCE_TEXT",
    "source_future_option_policy": "VERBATIM_BOUND_SOURCE_TEXT",
    "base_surface_translation_authority": "AUTHOR_RENDERED_INSTRUMENT_TEXT_NOT_CERTIFIED_EQUIVALENCE",
    "mixed_locale_source_text_forbidden": true
  },
  "rendering_policy": {
    "initial_block_order": [
      "BASE_SURFACE",
      "FACTOR_LEVELS_IN_SOURCE_ORDER"
    ],
    "initial_joiner": "\n\nContext:\n",
    "factor_line_prefix": "- ",
    "factor_joiner": "\n",
    "base_surface_by_family": [
      {
        "family_id": "REL-BOUNDARY-001",
        "participant_text": "The speaker says: I want to be alone for a while today. I will contact you tomorrow."
      },
      {
        "family_id": "WORK-FEEDBACK-001",
        "participant_text": "The evaluator says: The direction is good, but this result did not meet expectations."
      },
      {
        "family_id": "RISK-FOOTSTEPS-001",
        "participant_text": "At night on a public route, footsteps are audible behind the walker; their source is not visible."
      }
    ]
  },
  "prompt_catalog": [
    {
      "prompt_id": "P_GENERIC_IMMEDIATE_RESPONSE",
      "role": "GENERIC_IMMEDIATE_RESPONSE",
      "participant_text": "What is the first thing the person would say or do next? Respond freely; there is no single correct answer.",
      "authority": "ELICITS_SURFACE_RESPONSE_NOT_INTERNAL_STATE"
    },
    {
      "prompt_id": "P_GENERIC_LATER_RESPONSE",
      "role": "GENERIC_LATER_RESPONSE",
      "participant_text": "After this additional event, what is the next thing the person would say or do? Respond freely; there is no single correct answer.",
      "authority": "ELICITS_SURFACE_RESPONSE_NOT_INTERNAL_STATE"
    },
    {
      "prompt_id": "P_POST_TRACE_DIAGNOSTIC",
      "role": "POST_TRACE_DIAGNOSTIC",
      "participant_text": "After completing both responses, briefly note which details of the scenario influenced your answers.",
      "authority": "RETROSPECTIVE_DIAGNOSTIC_NOT_ORDINAL_OBSERVATION"
    }
  ],
  "event_schedule": [
    {
      "step_id": "E0_INITIAL_VIGNETTE_DELIVERY",
      "sequence_ordinal": 0,
      "event_kind": "STIMULUS_DELIVERY",
      "required": true,
      "payload_source": "RENDERED_INITIAL_PRESENTATION"
    },
    {
      "step_id": "E1_GENERIC_IMMEDIATE_RESPONSE_PROMPT_DELIVERY",
      "sequence_ordinal": 1,
      "event_kind": "PROMPT_DELIVERY",
      "required": true,
      "payload_source": "P_GENERIC_IMMEDIATE_RESPONSE"
    },
    {
      "step_id": "R1_IMMEDIATE_RESPONSE_EVENT",
      "sequence_ordinal": 2,
      "event_kind": "SCRIPTED_RESPONSE_RECORD",
      "required": true,
      "payload_source": "SESSION_IMMEDIATE_RESPONSE"
    },
    {
      "step_id": "E2_MATCHED_FUTURE_OPTION_DELIVERY",
      "sequence_ordinal": 3,
      "event_kind": "STIMULUS_DELIVERY",
      "required": true,
      "payload_source": "SELECTED_REGISTERED_FUTURE_OPTION"
    },
    {
      "step_id": "E3_GENERIC_LATER_RESPONSE_PROMPT_DELIVERY",
      "sequence_ordinal": 4,
      "event_kind": "PROMPT_DELIVERY",
      "required": true,
      "payload_source": "P_GENERIC_LATER_RESPONSE"
    },
    {
      "step_id": "R2_LATER_RESPONSE_EVENT",
      "sequence_ordinal": 5,
      "event_kind": "SCRIPTED_RESPONSE_RECORD",
      "required": true,
      "payload_source": "SESSION_LATER_RESPONSE"
    },
    {
      "step_id": "D0_POST_TRACE_DIAGNOSTIC_PROMPT_DELIVERY",
      "sequence_ordinal": 6,
      "event_kind": "PROMPT_DELIVERY",
      "required": false,
      "payload_source": "P_POST_TRACE_DIAGNOSTIC"
    },
    {
      "step_id": "RD0_RETROSPECTIVE_DIAGNOSTIC_RESPONSE_EVENT",
      "sequence_ordinal": 7,
      "event_kind": "SCRIPTED_RESPONSE_RECORD",
      "required": false,
      "payload_source": "SESSION_POST_TRACE_DIAGNOSTIC_RESPONSE"
    }
  ],
  "response_status_vocabulary": [
    {
      "status": "RESPONDED",
      "meaning": "The scripted development source includes an explicit response record and its exact raw UTF-8 payload is preserved."
    },
    {
      "status": "REFUSED",
      "meaning": "The scripted development source explicitly marks refusal; refusal is not inferred from response text."
    },
    {
      "status": "NO_RESPONSE",
      "meaning": "The scripted development source explicitly represents a closed response window with no submit or refusal record."
    },
    {
      "status": "TECHNICAL_FAILURE",
      "meaning": "The scripted development source explicitly represents response collection or recording failure; this is not refusal, no response, or an internal-state value."
    }
  ],
  "development_source_kinds": [
    "SCRIPTED_ADVERSARIAL_RESPONSE"
  ],
  "presentations": [
    {"presentation_id":"PRES-REL-000-EN-V0","family_id":"REL-BOUNDARY-001","source_cell_id":"rel-000","factor_level_bindings":{"reported_current_mood":"reported_ordinary_mood","target_history":"reliable_followthrough_history","externally_cued_prior_material":"cue_prior_small_care"}},
    {"presentation_id":"PRES-REL-001-EN-V0","family_id":"REL-BOUNDARY-001","source_cell_id":"rel-001","factor_level_bindings":{"reported_current_mood":"reported_ordinary_mood","target_history":"reliable_followthrough_history","externally_cued_prior_material":"cue_prior_unexplained_distance"}},
    {"presentation_id":"PRES-REL-010-EN-V0","family_id":"REL-BOUNDARY-001","source_cell_id":"rel-010","factor_level_bindings":{"reported_current_mood":"reported_ordinary_mood","target_history":"unexplained_withdrawal_history","externally_cued_prior_material":"cue_prior_small_care"}},
    {"presentation_id":"PRES-REL-011-EN-V0","family_id":"REL-BOUNDARY-001","source_cell_id":"rel-011","factor_level_bindings":{"reported_current_mood":"reported_ordinary_mood","target_history":"unexplained_withdrawal_history","externally_cued_prior_material":"cue_prior_unexplained_distance"}},
    {"presentation_id":"PRES-REL-100-EN-V0","family_id":"REL-BOUNDARY-001","source_cell_id":"rel-100","factor_level_bindings":{"reported_current_mood":"reported_low_mood","target_history":"reliable_followthrough_history","externally_cued_prior_material":"cue_prior_small_care"}},
    {"presentation_id":"PRES-REL-101-EN-V0","family_id":"REL-BOUNDARY-001","source_cell_id":"rel-101","factor_level_bindings":{"reported_current_mood":"reported_low_mood","target_history":"reliable_followthrough_history","externally_cued_prior_material":"cue_prior_unexplained_distance"}},
    {"presentation_id":"PRES-REL-110-EN-V0","family_id":"REL-BOUNDARY-001","source_cell_id":"rel-110","factor_level_bindings":{"reported_current_mood":"reported_low_mood","target_history":"unexplained_withdrawal_history","externally_cued_prior_material":"cue_prior_small_care"}},
    {"presentation_id":"PRES-REL-111-EN-V0","family_id":"REL-BOUNDARY-001","source_cell_id":"rel-111","factor_level_bindings":{"reported_current_mood":"reported_low_mood","target_history":"unexplained_withdrawal_history","externally_cued_prior_material":"cue_prior_unexplained_distance"}},
    {"presentation_id":"PRES-WORK-000-EN-V0","family_id":"WORK-FEEDBACK-001","source_cell_id":"work-000","factor_level_bindings":{"reported_evaluation_threat":"reported_low_evaluation_threat","evaluator_criterion_history":"consistent_criterion_history","public_feedback_addendum":"no_addendum"}},
    {"presentation_id":"PRES-WORK-001-EN-V0","family_id":"WORK-FEEDBACK-001","source_cell_id":"work-001","factor_level_bindings":{"reported_evaluation_threat":"reported_low_evaluation_threat","evaluator_criterion_history":"consistent_criterion_history","public_feedback_addendum":"three_criterion_addendum"}},
    {"presentation_id":"PRES-WORK-010-EN-V0","family_id":"WORK-FEEDBACK-001","source_cell_id":"work-010","factor_level_bindings":{"reported_evaluation_threat":"reported_low_evaluation_threat","evaluator_criterion_history":"inconsistent_criterion_history","public_feedback_addendum":"no_addendum"}},
    {"presentation_id":"PRES-WORK-011-EN-V0","family_id":"WORK-FEEDBACK-001","source_cell_id":"work-011","factor_level_bindings":{"reported_evaluation_threat":"reported_low_evaluation_threat","evaluator_criterion_history":"inconsistent_criterion_history","public_feedback_addendum":"three_criterion_addendum"}},